Plan Name,Plan URL,Plan Resolution,Planning Method,Acquisition,Easement,Stewardship,Habitat,Water Quality ,Resources/Species,Community Resilience,Ecosystem Resilience,Gulf Economy,Plan Timeframe,Agency Lead,Geo Extent,ref_num
Coastal Heritage Preserve Initiative: Bayside Acquisition and Easement,http://www.nfwf.org/gulf/Documents/tx-bayside-acquisition-14.pdf,Barrier Island,expert opinion,yes,yes,yes,"acquire 99-acres of critical bayside, barrier island habitat in the West Galveston Bay complex. As a part of the larger 360-acre Coastal Habitat Preserve Initiative, this investment will protect and enhance essential breeding, nesting, feeding and cover habitat for numerous avian and aquatic species, including protected migratory and endangered bird species injured by the oil spill",,,,,,2014,"Artist Boat, Inc NFWF",Galveston Island,291
Virginia Point Shoreline Protection and Estuarine Restoration,http://www.nfwf.org/gulf/Documents/tx-virginia-pt-14.pdf,Estuary,expert opinion,yes,yes,yes,"protect nearly 10,000 feet of fragile shoreline and restore nearly 25 acres of marsh within the 3,000-acre Scenic Galveston Coastal Preserve, one of the largest privately owned contiguous nature preserves on the upper Texas coast",,,,,,2014,TX GLO NFWF,West Galveston Bay,292
Oyster Lake Shoreline Protection and Restoration,http://www.nfwf.org/gulf/Documents/tx-oyster-lake-14.pdf,Barrier Island,expert opinion,no,no,no,"protect 4,700 feet of fragile shoreline and critical coastal marsh habitat in West Galveston Bay",,,,,,2014,Galveston Bay Foundation NFWF,West Galveston Bay,293
Egery Flats Marsh Restoration,http://www.nfwf.org/gulf/Documents/tx-egery-flats-14.pdf,Estuary,expert opinion,no,no,no,,"restore hydrology and reduce salinity to enhance over 600 acres of emergent marsh, submerged aquatic vegetation, and tidal flats at Egery Flats in the Aransas Bay complex near the Aransas National Wildlife Refuge. This effort is expected to result in 300 acres of restored estuarine marsh habitat",,,,,2014,Coastal Bend Bays and Estuaries Program NFWF,Aransas River and Copano Bay,294
Nueces Bay Rookery Islands Restoration,http://www.nfwf.org/gulf/Documents/tx-rookery-islands-14.pdf,Estuary,expert opinion,no,no,no,restore and protect over 3 acres of important colonial water bird nesting habitat on four rookery islands in Nueces Bay,,,,,,2014,Coastal Bend Bays and Estuaries Program NFWF,Nueces County,295
Sea Rim State Park Coastal Dune Restoration,http://www.nfwf.org/gulf/Documents/tx-sea-rim-dunes.pdf,County,expert opinion,no,no,no,restores 5.3 miles of dune habitat by planting native dune vegetation to accelerate natural dune recover,,,,,,2013,Texas Parks and Wildlife Foundation NFWF,Jefferson,296
West Galveston Bay Conservation Corridor Habitat Preservation,http://www.nfwf.org/gulf/Documents/tx-west-galveston-bay.pdf,Estuary,expert opinion,yes,yes,yes,"acquire a permanent conservation easement on a contiguous 3,200 acre tract(s) of estuarine emergent marsh, open water, prairie depressional wetlands and upland prairie habitat. This tract is located within the West Bay Conservation Corridor in close proximity to 6,500 acres of conserved habitat",,,,,,2013,"SCENIC GALVESTON, Inc",West Bay of Galveston Bay,297
Gulf Coast Migratory Waterfowl Habitat Enhancement,http://www.nfwf.org/gulf/Documents/tx-migratory-birds.pdf,Coastal_zone,expert opinion,yes,yes,yes,"Create freshwater wetland habitat on private lands in the Texas Chenier Plain and Mid-Coast to address habitat deficits in this important migratory bird region of the coast.enroll over 22,000 acres of agricultural lands to be flooded seasonally to support migratory waterfowl, shorebirds and waterbirds.",,,,,,2013,Ducks Unlimited NFWF,Coastal_zone,298
